{
  "status": "blocked",
  "missing_capabilities": [
    "literature_search"
  ],
  "sources": [
    {
      "source_id": "fixture:scope-1",
      "kind": "user",
      "locator": "Synthetic example question; not a real paper or executed search",
      "access": "user_input"
    }
  ],
  "limitations": [
    "Synthetic example: required capability is unavailable; no research operation was performed."
  ],
  "search_runs": [],
  "paper_ids": [],
  "screening": [],
  "next_queries": []
}
